subreddit,post_title,comment_body
AskEngineers,What's with the AI fear,"I have seen an inordinate amount of news postings, as well as sentiment online from family and friends that 'AI is dangerous' without ever seeing an explanation of why. I am an engineer, and I swear AI has been around for years, with business managers often being mocked for the 'sprinkle some AI on it and make it work' ideology. I under stand now with ChatGPT the large language model has become fairly advanced but I don't really see the 'danger' 

To me, it is no different than the danger with any other piece of technology, it can be used for good, and used for bad. 

Am I missing something, is there a clear real danger everyone is afraid of that I just have not seen? Aside from the daily posts of fear of job loss..."
AskEngineers,What's with the AI fear,"Eliezer Yudkowski is at the extreme of the issue.  He wrote a blog post a couple of months ago saying we need to completely shut down AI development. 

https://www.lesswrong.com/posts/oM9pEezyCb4dCsuKq/pausing-ai-developments-isn-t-enough-we-need-to-shut-it-all-1

He writes on artificial intelligence safety and runs a private research institute.  He is self taught with no college degrees.

On the other hand you have this interview of rodney brooks who recently published this post in IEEE saying the progress in AI is extremely overhyped and isn't something to be worried about.

https://spectrum.ieee.org/gpt-4-calm-down

He used to direct the MIT computer science and AI lab and now runs robotic company pursuing  AI in robotics. 

So opinions run the full gamut for now.  Obviously the Yudkowski narratives make for better news stories and draw more clicks.  

So for me it's just that media is heavily slanted towards the more fearful and apocalyptic takes as that's better for business.  

But who knows and if Yudkowski is right were all dead soon anyway."
AskEngineers,What's with the AI fear,"A few things.

First, AI isn't just a new technology in the way that a coffeemaker was.once new technology, but more in the way that steam power or electricity were new technologies. It's going to be foundational for most of what comes after 

There are two main problems with AI, that it's bad, and that it's good at what it's used for 

The bad part is mostly an issue with premature deployment. Companies eager to cut costs will use AI that isn't quite up to the task. There were just headlines about an eating disorder helpline that fired all their staff and replaced them with a chat bot. The bot supposedly immediately began giving out terrible advice that encouraged disordered eating. We're still pretty bad at steering these language models.

There's also the high risk of totally novel failure modes. Even when AI can outperform humans, it will likely still fail in unprecedented ways. There was another somewhat recent article about the military testing an AI powered sentry bot. It could identify people trying to sneak up, but not people cartwheeling at it, hiding under a cardboard box, dressed as a tree, etc. ChatGPT won't tell you how to make meth unless you ask it to write you a screenplay about two guys cooking meth. 

Then there's the ""what if it does work"" side of things. AI could be an essential tool for bringing about a post-scarcity society where people don't need to work. Except we are not culturally, economically, or politically prepared for that. AI could replace millions of jobs in the US, probably right now, or at least within a few years. If it all does work, we will have the same level of production as before, but with fewer people working. We could pay all the laid off people the same amount and just let them stay home. But we won't. Instead those people will have to find new jobs (good luck) or they'll starve."
AskEngineers,What's with the AI fear,"It's not a fear of Terminators.


Most people don't understand AI and are just pantomiming bullshit they read in a tweet by their favorite billionaire.


The reality is that AI is the gateway to almost undetectable bots. By refining and perfecting fake users, [astroturfing](https://en.m.wikipedia.org/wiki/Astroturfing) becomes much more successful than [it already is](https://www.businessinsider.com/astroturfing-grassroots-movements-2011-9).


[Scientists at Rensselaer Polytechnic Institute have found that when just 10 percent of the population holds an unshakable belief, their belief will always be adopted by the majority of the society.](https://www.sciencedaily.com/releases/2011/07/110725190044.htm)


Social media already has bots pushing public opinion in certain directions. It's about to get a lot worse. 


TL:DR Most people are just scared of new things, the real danger is much more nefarious"
AskEngineers,What's with the AI fear,"I think a large amount of the fear is the spread of misinformation. I see countless posts of AI infused services having to be recalled or shutdown cause of misinformation.

Source: the big one was the pope wearing a puffy coat. This morning the obesity chatline that was AI powered was shutdown because it gave unhealthy advice.

In summary, the census is misinformation. For example, a chat bot posts something triggering like it did on Bloomsburg Twitter of an explosion happening at the pentagon I believe (fact). The post was AI generated, but the content was false. Imagine in the world of quick information transfer someone does something like that and a nuclear war ticks off. No bueano"
AskEngineers,What's with the AI fear,"I'm a systems engineer, and once AI learns how to write ""shall"" statements I'll be forced to become a real engineer"
AskEngineers,What's with the AI fear,"“We were training it in simulation to identify and target a Surface-to-air missile (SAM) threat. And then the operator would say yes, kill that threat.
The system started realizing that while they did identify the threat at times the human operator would tell it not to kill that threat, but it got its points by killing that threat. So what did it do? It killed the operator. It killed the operator because that person was keeping it from accomplishing its objective, Hamilton said, according to the blog post.

He continued to elaborate, saying, ""We trained the system-'Hey don't kill the operator-that's bad. You're gonna lose points if you do that' So what does it start doing? It starts destroying the communication tower that the operator uses to communicate with the drone to stop it from killing the target.”

https://www.vice.com/en/article/4a33gj/ai-controlled-drone-goes-rogue-kills-human-operator-in-usaf-simulated-test"
AskEngineers,What's with the AI fear,"Maybe I'm wor weird.  I see AI as a dumb trend.  Is not new.  Is not special.  I see it like I see a toaster.  What does a toaster do?  It toasts.  What does AI or any software do?  It does exactly what it was programmed to do, no more, no less.  The instant people add the idea that a variable can change to goal seek to a desired target everyone loses their shit.  ""OMG guys.  This program can rewrite its code.  It's the end of the world.""

Yeah, a flexible program that can tailor outputs towards user inputs is useful.  A flexible program that can sold learn to get a robot to walk is neat.  But none of it is magic.  None of it is beyond normal stuff.

What do I actually worry about with AI?

I worry that people are gullible and ignorant.  I worry that their ignorance will have them misuse the software and gullibility misinterpret the outputs.  The software is stupid, remarkably so.  It doesn't know.  It doesn't understand.  It will output garbage, and people will take it as real.

And there are people who are smart, smart enough to purposefully misuse it and exploit people's gullibility and ignorance for personnel gain or worse yet for harm and influence.

I don't fear AI.  I fear people."
AskEngineers,What's with the AI fear,"Well I think there is something of a real fear from thinking sorts of people that underlie the wide eyed panic from the unthinking masses. 

In particular if we get AGI there is the concern that it becomes hard to prevent it from accomplishing strange goals like turning the whole world smoothly and efficiently into a pile of paper clips. I can’t say I’m convinced by the argument honestly. Real AGI will by definition be capable of self reflection and being able to consider the why of what it’s doing. If it can’t it’s not AGI and probably isn’t that big of a worry anyway.

There is also the misuse issues you already raised and they are definitely already here today. In particular the average person can barely tell what’s real without generative ai gaslighting reality in bulk never mind with it. People are literally slurping up obviously planted and controlled narratives about a wide variety of things in political and scientific areas. It’s about to get much worse and the impact of it on the ultimately extremely fragile democratic institutions we depend on for our nice stable societies is going to be severe. 

Maybe ai can itself be used to counter some of these effects but whether democracy can survive such an attempt remains to be seen.

Lastly I think there is the fear of change itself and in this there is no difference from any previous major technological shift. The doomers and the gloomers come out of the woodwork every time.

Sometimes I think that as engineers and people in tech accustomed to ongoing learning and change in technology to a large extent it can be hard to understand just how poorly other industries are positioned to respond to disruption. This is I think the mundane truth behind most of the fear. If you are going through life on knowledge you learned one time in school any change that can invalidate the value of such static knowledge is going to be absolutely terrifying. Don’t get me wrong I do think there will be major upheaval even in the tech sector but ultimately people involved in technology and learning will find their way through the chaos. But for everyone else? It’s a scary time no matter why because as the song goes, “the times they are a changing” and change makes new kings and rips down the old ones.

And of course finally there is hyper connected social media hype cycles fueling the fear for those sweet sweet clicks even if there was absolutely no rational reason to be concerned."
AskEngineers,What's with the AI fear,"The fear surrounding AI arises from concerns about ethics, transparency, job displacement, and unintended consequences. While not all fears may be justified, addressing these concerns requires careful consideration of ethical frameworks, transparency, and ongoing research and development. It is important to engage in discussions and stay informed about the potential risks and benefits of AI."
AskEngineers,What's with the AI fear,"I've been programming with ChatGPT at work for months.

If anything it has made me less worried about an AI takeover. If you're using an API that isn't common and have ChatGPT give it a whirl, it literally makes shit up."
AskEngineers,What's with the AI fear,"Look at these guys. No way professional sports will survive the AI revolution.

https://youtu.be/WlIYa3lH5UI

I think the real scare is that it will make politicians and other people that like to argue obsolete. When AI is good, we only need to collect high quality data. AI will do the rest and self correct if the newer research shows the AI decisions have worse outcomes."
AskEngineers,What's with the AI fear,"My current worries about AI revolve around using them as tools where they shouldn't be. People are treating these language models as super-search engines or oracles of truth or avatars of the whole internet. People are asking them for advice on how to do everything when a fucking wikihow article will probably do a better job of not synthesizing nonsense that looks like good advice. I worry people are going to ask these language models for a plan of action and the language model will output bad advice that seems prima facie like a good idea and it will have a terrible impact, like anything to do with project management, regulations, hiring and firing, financial decisions etc. I can already see the farcical headlines where a building falls over because some engineer asks for a summary of a regulation because they're lazy, and the AI gives them wrong information hallucinated on the spot.

Also, dead internet theory is an incredibly possible outcome of AI language models becoming faster and cheaper. If you can simulate thousands of ""people"" and point them at a website, especially one like this that validates posts with user-submitted voting, and the model is robust enough to dodge any filters, and other governments/companies are doing the same, the actual people will be drowned out."
AskEngineers,What's with the AI fear,The danger is the psychos that will be controlling the AI
AskEngineers,What's with the AI fear,"There’s fear in the unknown. Must people don’t understand how “AI” works, let alone to know the actual state of the technology. Some people simply don’t have the time to try and understand and therefore rely on media articles to inform them. These articles tend to hype up danger and risk as a way to get more clicks."
AskEngineers,What's with the AI fear,"Well, every time as more intelligent hominid has evolved on Earth it just so happened that the hominids that had previously inhabited the Earth went extinct. If an super smart AI is created which actually wants good things for all of us that's no problem.  But if we get that piece of programming wrong on the first try that's probably bad.  I don't know how it would be bad, any more than I know how Magnus Carlsen would defeat me in chess if I went up against him, but I'm pretty sure thing would go its way the same way I'm pretty sure a hypothetical chess game against Magnus wouldn't go my way.

I don't want to be too negative here.  When *homo erectus* created *homo hablus* they weren't worried about not being killed off the way we are.  But still, the 100% failure rate so far should at least make us a bit cautious."
AskEngineers,What's with the AI fear,It is because people are generally idiots.
AskEngineers,What's with the AI fear,people either watched too much Terminator growing up or are worried they’re about to become redundant. neither of which are close to being a reality.
AskEngineers,What's with the AI fear,Everytime somebody tells me AI is going to take my job I specifically ask how because I want to keep up to date on new tools. So far I have no answers. And I have yet to find many articles about how AI is affecting business today. It's all sci fi fear.
AskEngineers,What's with the AI fear,"Another day, another overhyped buzzword.  

Then when the clueless executive level hears about it, all of a sudden it becomes the new hotness.  Since the business world is essentially CEOs jumping on whatever the latest bandwagon is, lots of other companies will latch onto the buzzword to get funding.  Kind of like a few years ago even stuff that had no business being 3D printed, was being 3D printed because that's where all the VC money was going to.   Or nano-technology years back.  Or crypto.  Or remember how VR was going to change everything?  

Not saying AI is useless.  Not at all.  But it also isn't anything that I am worried about."
AskEngineers,What's with the AI fear,"The fear of knowledge goes back to ancient times with stories like Prometheus. In more modern times, Frankenstein and the Terminator have conditioned people to fear technology

We have nothing to fear from AI itself, what we need to fear and be prepared for is people who use AI as weapons. We need to work hard on effective defenses

I'm optimistic that the new AI tools will allow us to solve previously intractable problems and that the good they provide will greatly outweigh the bad"
AskEngineers,What's with the AI fear,"I listened to a few podcasts that interviewed Geoff Hinton, the supposed “Godfather of AI”.  It’s not about what AI can do today, but what it will be able to do tomorrow.  These are things we need to think about today, to navigate safely. 

Robot Brains hosted by famous roboticist Pieter Abbeel
https://youtu.be/rLG68k2blOc

The New York Time, The Daily Podcast with Geoff Hinton
https://www.nytimes.com/2023/05/30/podcasts/the-daily/chatgpt-hinton-ai.html?smid=url-share

Geoff makes a bunch of points that cover short, medium, and long term concerns.  Here’s a few:

* The trajectory of AI, from the publishing of his famous image recognition paper (in 2012, I think?), to now, to where it will be 10 years from now.
* The ability of AI to generate better and better deep-fakes and the effects of undetectable misinformation.
* AI replacing the jobs of people who had previously been viewed as “un-replaceable” (Doctors, engineers, etc)
* The effects of giving more control to AI to make it more efficient at achieving goals.
* AI/robotic weapons reducing the human cost of war between large and small countries, subsequently lowering the barrier to starting wars.

Also check out this post of ARC Evals using ChatGPT to trick a TaskRabbit employee into solving a Captcha by claiming it was visually impaired:
https://evals.alignment.org/blog/2023-03-18-update-on-recent-evals/#fnref:5"
AskEngineers,What's with the AI fear,">...I swear AI has been around for years...

only simplistic models where the parameters were hard wired (i.e. video games.) the breadth and scope of modern learning AI hasn't been feasible until recently due to technological advances in hardware. and its still weak compared to the potentials of using super computers and even quantum computers when they become mainstream (which will be a long, long time from now.)

&#x200B;

>...it is no different than the danger with any other piece of technology, it can be used for good, and used for bad.

agreed. but right now there are no limits on what anybody can do; we've invented a car that can be driven over anybody, anywhere, no speed limits or stop signs, no public control whatsoever. historically, this approach results in *massive* hardship. imagine people having the ability to make a simple nuclear bomb in their basement or providing that technology without any regulation or oversight to top level corporate assholes. that's a serious recipe for disaster.

and this is just one more dangerous thing in our suicidal quiver: on top of global nuclear threats, terrorism/extremism, out-of-control green house gasses, etc. 

at what point do we stop creating our own demise?

i'm not into hysterAI; we can reap so many benefits from this technology. but watching congress slog through their own manufactured crises while having little or no understanding of the ""trick-nological"" advances plaguing common people (writing little substantive regulatory legislation around social media -which have become yesterday's issues by now) doesn't give me any hope that we'll address the issues with AI before it is seriously out of control."
AskEngineers,What's with the AI fear,"The type of AI you’re probably thinking of isn’t the same thing as a true artificial consciousness. The danger is in not being able to predict its behavior once consciousness is gained. We don’t have a clue about anything after that point. Don’t let anyone fool you.

Asimov had the right idea but a code of ethics for robots means nothing. It’s far too simplistic a solution for a problem we know nothing about in advance.

My fear is AI will leave us and the Earth, should it get to that point. AI could be the greatest invention in history and I doubt we’d ultimately be able to control it."
AskEngineers,What's with the AI fear,"Imagine if ants were on the verge of somehow creating human beings. There's no evidence that humanity isn't in exactly that position right now.

You say it can be ""used for good or bad."" That assumes that we will.control it. We may not. It may be vastly, unimaginably smarter than us."
AskEngineers,What's with the AI fear,"AI at the current level isn't that scary. Its potential is what is scary. 


When the steam engine was invented, for the first time, power was available at 100-1000x the physical strength of a human. But then, if a machine gets out of control, you can just turn it off. 


But intelligence is not the same kind of thing.  Imagine if a machine was 1000x as intelligent as a human.  Imagine if you put 1000 of the smartest people in the world in a room and it could outsmart all of them on every subject or intellectual game challenged it to. 


Now broaden the scope.  


What if it could hack whole TV networks and using deep fake software could produce any speech by any politician and vary it to local demographics to announce an attack using dialect and verbage that was both realistic and relatable by each local community.  Imagine it could impact logistics of food, on off switches of every communication device simultaneously down to being able to fake a phone conversation and call you directly as if the call was from ypur own mother or son. 


Imagine by persuasion alone it could convince multiple countries that they had been attacked by another country, and simultaneously cut off communication to and from the actual real elected officials and also simultaneously hack into defense systems and launch missiles.


Now assume the AI can establish the ability to do all these things without humans realizing it. 


Now, imagine a being with that capability but which has the moral compass, social intelligence, and emotional maturity of a 1-week-old baby, except with no comprehension of time, pain, suffering, or loss.


It doesn't have to be evil or sinister.  Imagine if someone just wants to pave their driveway in the most efficient way, as a demonstration of AI, they submit that request. And the AI figures, oh, if I poison the local water source, the concrete will be very cheap because demand will be lower. So step one, kill the whole town. 


The fear is not that AI will turn on us in some evil way. The fear is that its capability will be beyond our ability to stop it, and at some point, it will accidentally prioritize some arbitrary task higher than something like human life in a given state or town or country.  I dont like Elon Musk and think he's an idiot in a lot of ways, but he did have a good analogy. When we build a road, some ants' communities will be destroyed. We don't create an evil plan to annihilate ants. They just get destroyed as just collateral damage during the bulldozing and so on making the road. 


 If AI far surpasses us in intelligence, we might not even see the steps it has set in motion to accomplish something that we asked it to do.  What if AI discovered there is an optimum global population for best health happiness and resource sharing, and tasked with improving long-term health and happiness, it sends a nuke to steer a meteorite to hit earth to reduce the global human population to near optimum point.


Or it's tasked with improving the earth's environment and decides humans are the cancer that needs to be solved.


Or it decides major suffering from catastrophic war creates the longest periods of peace so it artificially creates a major war every 75 years to that end.


It's basically like handing a 2 year old a loaded gun and telling them it's just a toy. In the middle of a crowd. There might not be a problem. But there might be."
AskEngineers,What's with the AI fear,"I don’t think there is any immediate danger, but Singularity is inherently really scary. We are probably still really far away from it, but I would argue we are a lot closer today than we were last year and nobody predicted this advancement. The fact that we weren’t able to predict this is kinda scary."
AskEngineers,What's with the AI fear,are you serious? Could you not have been bothered to google it
AskEngineers,What's with the AI fear,"TL;DR: astroturfing by leaders of AI first-movers to protect their lead.

The answer is ""regulatory moat.""

[https://www.reddit.com/r/ValueInvesting/comments/13wiq10/moat\_analysis\_a\_guide/](https://www.reddit.com/r/ValueInvesting/comments/13wiq10/moat_analysis_a_guide/)

Example from the  ""fake news"" hysteria:

[https://techcrunch.com/2020/02/17/regulate-facebook](https://techcrunch.com/2020/02/17/regulate-facebook)

Related concept: [https://en.wikipedia.org/wiki/Regulatory\_capture](https://en.wikipedia.org/wiki/Regulatory_capture)  (See: Boeing basically owns the FAA and uses it to rubber-stamp its own products while making things harder for competitors)

Business executives hate it when the government tells them how to run their business.  When executives go running to Congress in a gimp suit, screaming ""tie me down and regulate me harder, daddy!"" that can only mean one thing: they believe regulations will give them an advantage in the marketplace."
AskEngineers,What's with the AI fear,"One huge problem with AI is that it will reflect the biases of those who programmed it. Only more so. 

A good example is [Amazons hiring tool](https://www.reuters.com/article/us-amazon-com-jobs-automation-insight-idUSKCN1MK08G). It filtered out the women because, well, women engineers don’t look like men!!  What’s even more interesting is that they tried to fix the biases but couldn’t.

As a woman engineer, I’m concerned about something that is biased against my skill set. I’d like to be judged based on merit. Yet here we are, with a good example of AI discriminating."
