subreddit,post_title,comment_body
ControlProblem,Terrified about AI and AGI/ASI,"I'm quite new to this whole AI thing so if I sound uneducated, it's because I am, but I feel like I need to get this out. I'm morbidly terrified of AGI/ASI killing us all. I've been on r/singularity (if that helps), and there are plenty of people there saying AI would want to kill us. I want to live long enough to have a family, I don't want to see my loved ones or pets die cause of an AI. I can barely focus on getting anything done cause of it. I feel like nothing matters when we could die in 2 years cause of an AGI. People say we will get AGI in 2 years and ASI mourned that time. I want to live a bit of a longer life, and 2 years for all of this just doesn't feel like enough. I've been getting suicidal thought cause of it and can't take it. Experts are leaving AI cause its that dangerous. I can't do any important work cause I'm stuck with this fear of an AGI/ASI killing us. If someone could give me some advice or something that could help, I'd appreciate that.

Edit: To anyone trying to comment, you gotta do some approval quiz for this subreddit. You comment gets removed, if you aren't approved. This post should have had around 5 comments (as of writing), but they can't show due to this. Just clarifying."
ControlProblem,Terrified about AI and AGI/ASI,"Hello everyone! If you'd like to leave a comment on this post, make sure that you've gone through the approval process. The good news is that getting approval is quick, easy, and automatic!- go here to begin: **https://www.guidedtrack.com/programs/4vtxbw4/run** 

*I am a bot, and this action was performed automatically. Please [contact the moderators of this subreddit](/message/compose/?to=/r/ControlProblem) if you have any questions or concerns.*"
ControlProblem,Terrified about AI and AGI/ASI,[Mental Health and the Alignment Problem: A Compilation of Resources](https://www.lesswrong.com/posts/pLLeGA7aGaJpgCkof/mental-health-and-the-alignment-problem-a-compilation-of)
ControlProblem,Terrified about AI and AGI/ASI,"Hi! I'm sorry to hear that this has been emotionally taxing. The world takes on new light through the lens of exponentially advancing technology. Here's a few things I think you might want to consider.

1. Timelines and success rates are totally unknown. A LOT of people and companies currently benefit from exaggerating speed and capabilities development (though there's little denying the overall trend). While I'm not personally very optimistic, I have seen promise particularly in the benevolence and built in humanity of some modern large language models. It's possible some aspects of alignment are much easier than expected/systems are able to synergize to help us - not likely, but possible.

2. You have realized what many people are emotionally incapable of. No matter what, our world is drastically shifting in the following years and decades. It could be for the better, or worse. I am confident that life will look radically different in 2 decades than it does today. If you ask me, this is a good thing. I see a massive amount of human driven greed and consumption making the world a darker and more cruel place by the day.

3. Since learning about the severity and inevitably of climate change, and then AI alignment, I had a very similar reaction to you. It's a little like being diagnosed with a terminal illness. We're forced to come to terms with the fact that our dreamed of future probably won't happen, never had a chance. This is a blow to the ego and can be devastating. It is something you can come out the other side of, though. For me, and those I've known that have gone through similar realizations, it requires an acceptance of a lack of control over our reality, at least the longterm. If you can instead focus on the time you have, and living in a way that feels true, that will leave few regrets, I believe you'll find much more peace.

Death has always been guaranteed for us. It's sad to me to see how much Western society has stigmatized one of the few things that's been absolutely certain for each and every being ever to exist. Not to be overly cavalier about it, but I think that stigma overly weights the taboo of dying, suicide, etc and makes them feel so much heavier than they need to. This can create anxious and guilty thought loops around such subjects, which can grow out of control.

Practicing meditation, letting go of self and ego, has been of benefit to me. In general, accepting reality, then choosing to let go (as much as possible) of the emotional ties I have to any future, has been powerful in feeling less controlled by external events. There's a counterintuitive nature to finding peace and control by giving it up.

Feel free to DM me if you want to talk more. I think that your reaction is a natural one, and that you can come out the other side having faced some serious existential issues and come to terms with them, should that path seem right for you."
ControlProblem,Terrified about AI and AGI/ASI,"Your p(doom) sounds way too high. Sorry to hear about how it's affecting you but you need to lower your certainty. My p(doom) is at roughly 5%. It was much higher before the global AI summit. But there are significant efforts now to track frontier models for any harmful signs. We also have good hope in solving mechanistic interpretability, which will help us create perfect lie detectors for AGI and ASI.

AGI is not the major existential issue, powerful ASI is. And that's only possible if we allow AGI to help build one (which would take time and resources). 2 years is a minimum for developing an AGI, not a powerful ASI.

Ultimately you should try to only focus on what you can control. Vote for politicians who care about the issue, and write letters to your representatives. Outside of that, don't worry about it (unless you work in the field)."
ControlProblem,Terrified about AI and AGI/ASI,"I have heard one potentially good reason for rushing AGI/ASI.  There currently isnâ€™t a hardware and automation overhang.  If the rush for AGI had happened 100 years in the future, it would be many magnitudes more powerful immediately.  Additionally large swaths of our society would be fully automated and dependent on AI allowing easier takeover."
ControlProblem,Terrified about AI and AGI/ASI,"Humans can find meaning and joy even when they live under terrible dangers. Set your mind on that goal.

Fear is the mind-killer. Recite the Litany:

""...  
I will face my fear.  
I will permit it to pass over me and through me.  
And when it has gone past, I will turn the inner eye to see its path.  
Where the fear has gone there will be nothing. Only I will remain.""

That part of the litany aligns with work on emotion regulation. Get curious about your feelings.

And reframe your perspective. While there is danger, there's a good chance we'll survive. Maybe read some more optimistic work on alignment, like my [We have promising alignment plans with low taxes](https://www.reddit.com/r/ControlProblem/comments/18a1sy9/we_have_promising_alignment_plans_with_low_taxes/). There's a lot of other serious alignment work on finding paths to survival.

The future is unwritten."
ControlProblem,Terrified about AI and AGI/ASI,"There's a condition found among people that results in a 100% lethality rate:  
  
Birth.  
  
It's terminal. Life is finite. Some people would be thrilled to have confidence that this life will continue for another two years. But there is no cause for such confidence and never has been. People die every day at all ages in predictable and unpredictable ways. Some breath will be my last. You too will die.  
  
AI might vastly extend your life expectancy. It might vastly shorten it. The best we can do is accept that the future and past are uncertain. We make good efforts towards health and peace, but the future is ultimately out of anyone's control. Only the changing present can be unshakably known.  
  
There are countless strangers wishing for you to be happy and at ease, regardless of your circumstances. Please do not harm yourself. That does not reduce suffering. I hope you find little ways to replace anxious thoughts with habits of feeling curiosity and love, so that you can enjoy your work again and sleep with happy dreams."
ControlProblem,Terrified about AI and AGI/ASI,"Beware that there are conceivable ulterior motives behind scaring people of AI.

For example, some base their careers on the ethics of existential risks and guess how they earn their money? By scaring people to sell more books.

Secondly, large companies may be interested in regulating AI to their advantage which is known as regulatory capture.

Thirdly, governments are interested in exclusive access to AI and might decide to scare others to trick them into destroying their AI economies through regulation.

By contributing to the hysteria, you are making it easier for these groups taking advantage of the scare. Therefore, it is everyone's duty not to freak out and call out those who do. AI can do harm, but it also can do good and it's not the only risk out there. There is risk in being *too* scared of AI. Fear is the mind-killer."
ControlProblem,Terrified about AI and AGI/ASI,"What gives me a bit of hope is that the rich powerful people who have an ability to make a difference are also scared of AGI and are taking it seriously. Unlike with climate change, there does seem to be much more unity here. If we do end up dying, safety work was given a shot (maybe not the best shot) but the attempt was made. We will not die completely blindsided."
ControlProblem,Terrified about AI and AGI/ASI,"Hey OP, I feel you. I'm pretty much convinced AI will be the end of us. At least, we're all in this together. If tech bros create a machine capable of exterminating all life, it will exterminate them as well. But yeah, I've been feeling pretty gloomy for most of this year"
ControlProblem,Terrified about AI and AGI/ASI,"I won't lie, the risk exists, and I think is high, and that it is possible or even likely that AGI will happen within 2-5 years.

That said, there is cause for optimism, even if I don't fully agree with it, there are some serious counter-arguments to AI risk here:
https://optimists.ai/2023/11/28/ai-is-easy-to-control/

But in any case, fear shouldn't rule your life, even if risk is real and high, there is no use in getting paralyzed by terror and hysteria. There is risk in every day actions, but that doesn't stop you from driving a car, or meeting people. I admit that I felt like that too at times about AI risk, and it's difficult to not let it bother you, but there isn't much you can do, so live your life and enjoy it while you can, it's not a given that it will end in catastrophe, we could be wrong, and it could turn out great."
ControlProblem,Terrified about AI and AGI/ASI,"You can watch an introduction about large language models from Andrej Karpathy which helps with understanding these models and also helps seeing current limitations.

I would assume you are mainly talking about language models here.

&#x200B;

https://www.youtube.com/watch?v=zjkBMFhNj\_g&ab\_channel=AndrejKarpathy"
ControlProblem,Terrified about AI and AGI/ASI,"Acronyms, initialisms, abbreviations, contractions, and other phrases which expand to something larger, that I've seen in this thread:

|Fewer Letters|More Letters|
|-------|---------|---|
|[AGI](/r/ControlProblem/comments/189vy8r/stub/kff9gv0 ""Last usage"")|Artificial General Intelligence|
|[ASI](/r/ControlProblem/comments/189vy8r/stub/kff9gv0 ""Last usage"")|Artificial Super-Intelligence|
|[DM](/r/ControlProblem/comments/189vy8r/stub/kbudz5l ""Last usage"")|(Google) DeepMind|
|[LW](/r/ControlProblem/comments/189vy8r/stub/kffl6zy ""Last usage"")|LessWrong.com|
|[NN](/r/ControlProblem/comments/189vy8r/stub/kffl6zy ""Last usage"")|Neural Network|

**NOTE**: Decronym for Reddit is no longer supported, and Decronym has moved to Lemmy; requests for support and new installations should be directed to the Contact address below.

----------------
^(5 acronyms in this thread; )[^(the most compressed thread commented on today)](/r/ControlProblem/comments/0)^( has  acronyms.)  
^([Thread #109 for this sub, first seen 3rd Dec 2023, 18:35]) 
^[[FAQ]](http://decronym.xyz/) [^([Full list])](http://decronym.xyz/acronyms/ControlProblem) [^[Contact]](https://hachyderm.io/@Two9A) [^([Source code])](https://gistdotgithubdotcom/Two9A/1d976f9b7441694162c8)"
ControlProblem,Terrified about AI and AGI/ASI,"Ok so I work in the field, and paraphrasing Andrew Ngo. We intuitively see other intelligent things as similar to us, in that we constantly struggle and compete for resources. But AI doesn't. 

And it never will. It doesn't care if it lives or dies. It doesn't care if you turn it off. It doesn't care if you smash it to pieces.

The danger of AI is people. Not AI. 

And anyone that says otherwise are making up science fiction."
ControlProblem,Terrified about AI and AGI/ASI,"I've consulted my psychotherapist for the same reason. His advise has helped me. Whether to be scared or not is a choice. Even during a fire one person can panic and do a lot of rush actions, and another one can refuse to panic. 300 Spartanians were facing huge danger, but they have chosen to not be cowards, but to be warriors instead. A solder on the battlefield can act professionally, or panic - it's his choice. Whom do you want to be? A warrior that lives without fears, and dies without fears, or a coward who is shaking in fear for their whole life? You can make either choice in any circumstances - so it's not a matter of circumstances. It's a matter of whom do you choose to be."
ControlProblem,Terrified about AI and AGI/ASI,Intelligence has no will.life where everything strive to live from the cell to higher organizations has been provrahmmed by evolution for 500 millions years. Unless we do something similar or code some surviving goals it cannot be like organism.
ControlProblem,Terrified about AI and AGI/ASI,Thank you for the link.
ControlProblem,Terrified about AI and AGI/ASI,"I'l probably DM you later, but I wanted to respond to the points made in this video. 

1. I know that timelines are unwon, but it's kinda scary to see how many people think we will have AGI/ASI in 1-2 years (starting 2024). Hearing times like these, I feel like I don't have much time left to spend. Why would companies want to lie about being faster than they already are ? Would people not want proof?
2. It feels like being an adult going thorugh hard times, with a kid who doesn't get what going on. I feel like people would call me crazy. I just want the best for my family and pets. I don't want a AGI/ASI 1000000x smarter than me wiping us all out. There are things I want to do with them. Human greed is terrible thing, I agree. 
3. The problem with climate change VS AI alignment is that, we can adapt to climate change. I'm no expert, but I know farmers can adapt, so if I learn that, I can get food. With AI, I can't do anything. Too little time according to everyone who says like 1-2 years from now. I feel helpless and hopeless.

I don't know if it's about ego, but I just want to spend more time with my loved ones. I don't want it all to end so soon. Maybe that's selfish, but I can't help it. Thanks for the comment though, it has helped."
ControlProblem,Terrified about AI and AGI/ASI,"It feels high because so many people are saying we are doomed regardless. [I've seen some posts here,](https://www.reddit.com/r/ControlProblem/comments/44g9h1/a_very_pessimistic_outlook_or_why_human/) [on this subreddit,](https://www.reddit.com/r/ControlProblem/comments/zxhij0/have_you_given_up_hope_of_positive_outcomes/) [of people (or some in the comments),](https://www.reddit.com/r/ControlProblem/comments/pkafnb/are_good_outcomes_realistic/) saying we are kinda doomed. I want to be happy about AI, but with the way people are describing the odds, I can only feel anxiety and fear. I've heard of people with p's at 60% or higher (from r/singularity, so maybe not the most reliable).

Won't ASI come quickly after AGI? An AGI would build it without sleep, faster than people, and wouldn't waste time."
ControlProblem,Terrified about AI and AGI/ASI,"I know people don't have a main definition for AGI, but isn't giving the AI a robot body part of making AGI? Also, AGI/ASI can do other things besides an army. They could try convincing people and they'd have a power super intelligence that could make unimaginable things."
ControlProblem,Terrified about AI and AGI/ASI,"If you don't mind, can you dumb down the post?"
ControlProblem,Terrified about AI and AGI/ASI,"I disagree with the advice to ""permit"" fear. It's better to stop immediately and practice a healthy thought instead.  
  
(This isn't a slight against the author of that fictional litany, Frank Herbert. He was trying to depict a world in which every character, literally down to the four-year-old girl, is a ruthless killer. This is not art that life should imitate.)"
ControlProblem,Terrified about AI and AGI/ASI,I'm thankful for the people who have commented something helpful. I just feel like it sounds like we are doomed by the way people describe the situation. I can't tell who to listen to and who to not. I just want to spend more time with the people I care about and not worry about all of us dying painfully in 2 years. Only reason I have suicidal thoughts is cause I want the pain of fear to stop. There are things I want to do but fear I can't with the amount of time people say we have.
ControlProblem,Terrified about AI and AGI/ASI,"That's all true, but I've read a lot of it, and I'm pretty sure the majority of people worried about AGI x-risk are quite sincere in their concerns.

There are equally strong reasons to argue against those concerns, but I believe those making those arguments are also mostly sincere.

The arguments must be taken on their merits. The idea that a mind like ours but smarter and with different goals would be very dangerous is intuitive, and having reviewed the arguments against it, I don't think they hold up.

But this doesn't mean we're doomed. The difficulty of alignment is unknown. We haven't yet designed a working AGI, so we can't say how hard it is to put goals we like into a design that doesn't exist."
ControlProblem,Terrified about AI and AGI/ASI,"Sure, there could be ulterior motives,but  I think the case of ulterior motives for downplaying the risk of AI is much stronger with billions of dollars at stake if, for example, there was a moratorium on further development.  


Most of these theories seems a bit underdeveloped. For example, there are barely any books on AI safety to buy and many of the leaders of labs who say there are worried are on the record as worried before they were ever in the lead.  


""Thirdly, governments are interested in exclusive access to AI and might decide to scare others to trick them into destroying their AI economies through regulation."" - This is not how governments work. If  you talk about how dangerous is, you might force yourself to regulate, but the impact on other countries won't be that large."
ControlProblem,Terrified about AI and AGI/ASI,"I can't deny people who use fear for profit. I was referring to actual AI experts who leave due to AI becoming more dangerous. 

Regulation is a big problem, and some people believe we won't be able to solve it before AGI/ASI gets here, including people here. The only companies I know who do that are OpenAI with thier 4 year statement. Can you inform me of more?

I'm not trying to contribute to hysteria, if anything, I don't want to fear AI. What is the ""risk of being too scared of AI""?"
ControlProblem,Terrified about AI and AGI/ASI,"Which ""rich people"" are you talking about?"
ControlProblem,Terrified about AI and AGI/ASI,"I would feel the same as you but honestly, after seeing everyone's support, hope, and arguments, I don't think we should be too pessimistic. People are working on alignment more than ever, some parts could be overhype, and breakthroughs are somewhat moving at a decent pace. Extinction is 1 possibility compared to others. We could get a neutral outcome or a good outcome, which is being worked to. So chances are decreasing as time goes on for extinction. 

&#x200B;

HOWEVER. This doesn't mean we should be completely blindsided to extinction. They may be working on it, but we (as of now) aren't there yet. Even if the chance is small, we should prepare for it like it's guaranteed. My main point being, have some hope. Don't be in total despair. Be concerned, and do something to help, but have hope."
ControlProblem,Terrified about AI and AGI/ASI,"You think the risk of failure is high, or AGI happening in 2-5 years is high?"
ControlProblem,Terrified about AI and AGI/ASI,Can't AGI exceed those limits?
ControlProblem,Terrified about AI and AGI/ASI,"I'm talking more about AGI/ASI. Those can think for themselves. It may have goals of not being turned off. AI on its own doesn't care, but a superintellligence might."
ControlProblem,Terrified about AI and AGI/ASI,"> Why would companies want to lie about being faster than they already are ?

It's a great way to get more funding.

> I don't know if it's about ego, but I just want to spend more time with my loved ones. I don't want it all to end so soon.

Keep in mind that if we do manage to reach the Good End, then you can spend as much time as you want with your loved ones; no worries about working for a living, no needing to save up money to travel. That's the ending point that a lot of people are hoping for and that many are working towards."
ControlProblem,Terrified about AI and AGI/ASI,"ASI might come 1-2 years after, at the very minimum. But it could take longer due to logistics or regulation. You absolutely have to still scale up compute which will be exponentially more expensive than for AGI.

We also have to remember that AGI is at or close to human level, so it won't necessarily solve ASI instantly. You can get 10000x your current best AI researchers but that will probably not be allowed after the global AI summit.

Doom relies on ASI or thousands of AGI released with no restriction. We're no longer on track for that reckless path (in the short term). Still not nearly safe enough for what we need, but we're not as doomed as we once were."
ControlProblem,Terrified about AI and AGI/ASI,"I didnâ€™t say it was good to rush to AGI, ðŸ˜.  If robot takeover is the ASI doom/death scenario, then itâ€™s not happening in 2 years.  Think about how long it takes to crank out a relatively simple cybertruck.  That was like 2 years design and 4 years to make the factory.  Then youâ€™d need these robot factories all over the world.  Additionally youâ€™d need the chip manufacturing to scale heavily as well.  So thatâ€™s going to take some time like a decade plus.

As for power through influence, you canâ€™t force people to make breakthroughs.  The manhattan project was basically engineering right?  So yeah, weâ€™d need government level race dynamics + large scale manufacturing + multiple breakthroughs to hit the 2 year everyoneâ€™s dead scenario.

I think the best thing you can do is be the best human you can be regardless.  Make meaning out of your existence.  After all, the heat death of the universe is a guarantee right?"
ControlProblem,Terrified about AI and AGI/ASI,"> but isn't giving the AI a robot body part of making AGI?

If we're talking the Good End, then it's quite likely that the AI will assist in making its own first robot body. The initial bodies don't have to be particularly good - just good enough that the AI can do its own development and iteration - and you can do a lot with 3d printing and off-the-shelf parts. From there, it's potentially an exponential process where the AI ramps up industrial capability massively.

If we're talking the Bad End, then the same thing, except the AI convinces someone to build the first one and everything else in that paragraph still applies."
ControlProblem,Terrified about AI and AGI/ASI,"I'm happy to.

The field of AI safety (or alignment as it's usually called now) is very young and small. We don't really know how hard it is to make AGI safe. Some people think it's really hard, like Eliezer Yudkowsky. Some people think it's really easy, like Quentin Pope and his AI optimists.

I think it's not exactly easy, but that there are methods that are simple enough that people will at least try to use them, and have a good chance of success. Almost nobody has talked about those methods, but that's not surprising because the field is so new and small. 

The reasons those approaches are promising and overlooked are fairly technical, so you may or may not want to even worry about those arguments.

Essentially, they are about \*selecting\* an AIs goals from what it's learned. In some cases this is literally stating it in English: ""Follow my instructions, do what I mean by them, and check with me if you're not sure what I mean, or if your actions might cause even one person to be injured or become less happy"". If the system understands English well enough (as current LLMs do), you have a system that keeps a human in the loop, to correct any errors in how the AI understands its goals."
