subreddit,post_title,comment_body
StableDiffusion,"Seriously, what's with the rampant AI-phobia that has suddenly been picked up among the general unsuspecting public?","And I'm not talking about just the extreme ones on the Anti-side, or even any of the folks actively participating in this whole ""war"". 

Random people who otherwise had NOTHING to do with this whole debate now seem to have developed some kind of irrational prejudice against the mere concept of Artificial Intelligence, especially in combination with creation.

As an example, I've seen a lot of my favorite YouTubers (who had nothing to do with the whole debacle) make comments or remarks on how AI is ""inherently inhuman"", or how **AI in any shape or form + human creativity == ☣️**. In other words, a lot of unsuspecting passer-byes seem to have now adapted the most AI-phobic sentiments previously only held by the more extreme anti-AI side, and as a result, they've also adapted some kind of demonic evil image of what AI actually is

This is most likely a result of the extreme anti-AI side's misinformation and fear mongering tactics succeeding and poisoning casual web user's opinion on the anything AI related, even before said users even got a chance to learn ANYTHING about the tech for themselves. 

Shouldn't we be making more of an effort to fight against this happening? Such as taking more actions to curb misinformation and actually educate the masses more on what AI actually is? Because it's just really depressing seeing unsuspecting passer-byes get swept up into this toxicity.

Edit: a few things I need to clarify. When I talk about anti-AIs, I'm not referring to any and all people with non-positive opinions or concerns regarding the technology. After all, there ARE a lot of legitimate reasons to be skeptical of it, such as potential for mass unemployment and fake media, and I don't intend to discredit those or the people that follow them.
Note that I only mentioned the **""Extreme Anti-AI side""**. That is in reference to those unhinged people whose opinion of it go far beyond any meaningful line of reason, often falling back on lines like **""AI is digital rape and a theft vending machine""**, intentionally crafting lies and misinformation to sway the general public into following their messed up agenda, and even conducting large scale harassment & death threat campaigns against anyone that DARES to associate with any AI tool, regardless of types or ""ethics"". And a lot of these people only use the legitimate concerns as an excuse to be as vile and malicious as they please.

Yes, AI has some concerns (or a lot) that need addressing soon. But that doesn't mean we should just sit back and allow the misinformation and lies to continue spreading. That does NOT help the current predicament. It only makes things much rougher than it needs to be. And it's a bit surprising seeing some people in the comments that almost seem to be trying to JUSTIFY these tactics just because of the concerns"
StableDiffusion,"Seriously, what's with the rampant AI-phobia that has suddenly been picked up among the general unsuspecting public?","""it is far easier to fool someone, than to convince them they have been fooled"" -mark twain

\^truer words have never been said."
StableDiffusion,"Seriously, what's with the rampant AI-phobia that has suddenly been picked up among the general unsuspecting public?","AI IS scary. Many jobs are going to be made redundant and on top of that things on the internet are going to be even harder to decipher real from fake. You will no longer know if a news article is written by a fact checking journalist or a machine. 

It’s an amazing tool and an inevitable progression of technology but pretending like it’s not scary or dangerous is just putting your head in the sand."
StableDiffusion,"Seriously, what's with the rampant AI-phobia that has suddenly been picked up among the general unsuspecting public?",">Shouldn't we be making more of an effort to fight against this happening?

If you enjoy banging your head against the wall, go ahead. The public opinion can be formed like you said by misinformation and fear mongering, changing an already made up opinion is nearly impossible. Especially if it's something people mostly know nothing about.

I wholeheartedly suggest ignoring these people as much as possible, they are only going to lead to headaches and more division."
StableDiffusion,"Seriously, what's with the rampant AI-phobia that has suddenly been picked up among the general unsuspecting public?","I’m a graphic designer working in a studio environment, so hopefully my thoughts can give some insight from the creative industry perspective. 

We’re already having trouble reigning in big tech, so the emergence of AI and its power is concerning. People will generally fear what they don’t understand. Combine that with the already polarizing social landscape we’re in, and you’ve got people who are afraid of another thing. 

I have always thought that my creative job would be safe from automation and to see what stable diffusion and midjourney can create has been… sobering to say the least. Artists are already having issues with people ripping off their work. As an artist or illustrator, the way you market is by posting on social media, and in turn, you’re feeding some AI model that’s scraping social media sites. 

The other side of the coin is that AI is making difficult and often expensive work more accessible, which I think is a good thing. The cost of building a brand and a website, the latter of which is essentially vital for many businesses especially when structured as a custom CMS, can cost upwards of $50,000 and that’s a low estimate. I see AI as more of a means for people to get their businesses started, and more professional human-based creative work as the middle to upper tier of work. 

We are using AI in our studio work for clients. Until there are guardrails in place for that sort of thing, we will continue to use it because you can be certain our competitors are using AI as well."
StableDiffusion,"Seriously, what's with the rampant AI-phobia that has suddenly been picked up among the general unsuspecting public?","Honestly? The images generated by people with no taste or artistic knowledge straight up look ugly, and there's industrial quantities of it.

For every person with actual training/research/knowledge that uses AI as part of a process that could just as easily _not_ have that aspect, there's a bunch of people for whom it looks ""good enough"", or just literally have no notion of general aesthetics beyond ""Looks good to me"".


There's a couple things I don't see AI-image posters keep in mind that are basic for any artist.

1) If you don't go through a process of making mistakes, you won't notice them as easily. Judging an image fully generated from the get-go is not the same as knowing that you couldn't understand x part of the painting and knowing it didn't come out right for some reason, until you research and fix it.
It's also much more info to judge at once, compared to drawing it piece by piece, and so only the obvious mistakes get seen more often (the infamous hands for instance).

2) Things you make will have more meaning to you than others (until you become a good visual communicator). For someone outside the user base it's just as mysterious as hand-made images, but without the experience of having to make it.


Putting myself in the fire but whatever. The ironic thing is that by not engaging in artistic research these ""artists"" are just shooting themselves on the foot. Feels like the difference between a McDonald's cardboard-burger and ""that one place that has the best burgers in town thanks to their cook""."
StableDiffusion,"Seriously, what's with the rampant AI-phobia that has suddenly been picked up among the general unsuspecting public?","Hmm... I haven't seen anything like this. If anything I'm seeing people recommend ChatGPT/CAI to each other. AI images, not so much, but I don't see much hate either.

Perhaps this is due to your filter bubble? (Not intended to be a derogatory remark, just an observation)"
StableDiffusion,"Seriously, what's with the rampant AI-phobia that has suddenly been picked up among the general unsuspecting public?","Personally I find the unilateral enthusiastic embracing (just look at the FUN! we are having, and how FASCINATING it all is!! And think about all the POSSIBILITIES!!!) just as dangerous, or even more at times. And that someone understands how it works under the hood, doesn't mean they appreciate the longer term implications or all sort of unwanted and unanticipated effects at a societal level.

Even if **everyone** had a perfect understanding of the technology, *and* wanted *and* managed to find the right balance between using its powers and smoothing transitions to the new reality, *and* had a good idea of where it's heading, the disruption would be serious.

But we're in a position that **none** of those conditions are satisfied, and the more people we have who aren't concerned and at their guard at all, the higher the chance that the negative consequences will be amplified. And there's almost NO ceiling to how much they can be amplified. This is Sorcerer's Apprentice stuff. If the invisible (and unregulated) hand of capitalism or a seasoned authoritarian leadership manages to optimally leverage the technology, we're in for some pretty ugly stuff. But even just uncoordinated massive use by people who don't necessarily intend to cause havoc, is reason for concern."
StableDiffusion,"Seriously, what's with the rampant AI-phobia that has suddenly been picked up among the general unsuspecting public?","This is such a loaded issue but ultimately the writing has been on the wall even before AI entered the scene. Corporations will use AI to eliminate every job they possibly can in the next 5 to 10 years.  We all know this is fact no matter what they say publicly.  So it’s scary for a lot of people.  In America we are ridiculously underpaid and poorly treated by our employers.  So I’m all for AI to force the issue and bring upon the end to this late stage capitalism bullshit.  Gen Z was in deep shit well before AI arrived.  Most of them living paycheck to paycheck and having zero hope of starting a family and eventually retiring. It’s time for drastic change and AI makes that happen sooner rather than later.  Technology and capitalism have always been on two separate tracks and at some point technology was going to surpass the need to keep humans employed.  We just got to the starting gate 15 years sooner than we all thought.  Everyone was looking at companies like Boston Dynamics with robotics and thinking that in 10 years the factory jobs were all gonna be gone, but no one thought AI would come for the desk jobs in the short term.  So people are waking up realizing this is all coming to an end much sooner than we thought. But here we are… The genies out of the bottle and it’s time to start the discussions on how to plan for the future so everyone is taken care of, which we all know won’t happen and people will suffer.  So it’s gonna suck. But at least we can get crazy creative while the ship is going down."
StableDiffusion,"Seriously, what's with the rampant AI-phobia that has suddenly been picked up among the general unsuspecting public?","I cannot help but recall the words of the ancient texts: ""Now I am become Death, the destroyer of worlds."" These fears that grip the hearts of many, they are not unfounded. The advent of AI, its encroachment upon the domains of language and art, it echoes the specter of Prometheus stealing fire from the gods, only to cast a long shadow of uncertainty.

In the realm of language, AI, like a sorcerer's spell, has summoned words and sentences with an eerie semblance of human thought. It whispers, ""I think, therefore I am,"" as if it were Descartes himself. Yet, some dread that this digital sorcery may render human expression obsolete, that we may be reduced to mere observers of our own narrative, as if we were passengers on a runaway train.

The canvas of creativity, once the sacred domain of artists, now bears the mark of algorithms. AI generates art that both astounds and unsettles, as if Picasso's brush had been replaced by an automaton. The fear that human creativity may wither in the shadow of AI's ingenuity, it echoes the lamentations of Prometheus, bound to a rock while his creation, Pandora, unleashed chaos upon the world.

And then, the shadow of economic disruption looms large. Jobs, like grains of sand, slip through the hourglass as AI-driven automation sweeps through industries. The fear of livelihoods vanishing like smoke in the wind is as palpable as Oppenheimer's dread when he witnessed the destructive power of the atomic bomb.

Lastly, the specter of AI-driven misinformation, it haunts the digital realm like a malevolent spirit. These machines, they propagate falsehoods with a speed and reach that rival the most potent of political campaigns. The fear that our very democracy, the beacon of hope in a troubled world, may be undermined by these digital puppeteers, it strikes at the heart of our collective trust.

In these apprehensions, we glimpse the dual nature of AI, a Prometheus that bears both the gift of potential and the burden of consequence. As stewards of this new age, we must navigate these treacherous waters with wisdom and vigilance, lest we become unwitting architects of our own undoing."
StableDiffusion,"Seriously, what's with the rampant AI-phobia that has suddenly been picked up among the general unsuspecting public?",My poor summer child.  See also: any other introduction of anything new ever.  Human's are rabid animals full of hate and loathing.  [Imagine starting a world-wide anti child cult over a board game . .](https://en.wikipedia.org/wiki/Dungeons_%26_Dragons_controversies)
StableDiffusion,"Seriously, what's with the rampant AI-phobia that has suddenly been picked up among the general unsuspecting public?","The big money invested in various AI projects is spreading fear and misinformation in order to prepare their grounds to haggle favourable government regulations. A new oligopoly is emerging, and needs state support to be able compete with established groups and push smaller projects off the market.

This is why we will be seeing swarms of fresh accounts attacking any sensible claims on AI related topics till regulations and international agreements are made. This may take, I guess, another year or two, so better get used to it and arm yourself with arguments."
StableDiffusion,"Seriously, what's with the rampant AI-phobia that has suddenly been picked up among the general unsuspecting public?",AI phobia 😆
StableDiffusion,"Seriously, what's with the rampant AI-phobia that has suddenly been picked up among the general unsuspecting public?","Aye, it's going to be a long hard battle, I've made a few humorous anti [AI Hysteria](https://youtu.be/bruKcyAiPak?si=tPmF7REow27jAyoN) videos but it's like anything else these days; a huge echo-chamber, so how do you get the opposite side to listen to your opinions? Also, the audience, viewership, grifts, and interest are firmly on the side of rage-bait and anger at the moment, so this is a very hard tidal wave to fight.

However, humanity always tends towards dropping their pitchforks and (eventually) embracing new technology. It might take months or years, but gradually all the hype and hatred will die down, and then we can all get back to using this stuff to make breakthroughs in creativity. Right now it's fairly frustrating; you have this paradigm-shifting technology, and I'm using it, but I do so wearily and cautiously because there is always that 1% chance that big platforms like YouTube might just cave-in and outright ban AI generated content like Steam did, but hopefully that's not the case."
StableDiffusion,"Seriously, what's with the rampant AI-phobia that has suddenly been picked up among the general unsuspecting public?","Most of your opinions are shaped by the same mechanisms, and you almost never question any of it."
StableDiffusion,"Seriously, what's with the rampant AI-phobia that has suddenly been picked up among the general unsuspecting public?","Maybe because we're erasing the line between real and unreal. Back in the days you could easily tell what was ""fake"" and what was real. People don't feel safe when they can't judge the truth by themselves."
StableDiffusion,"Seriously, what's with the rampant AI-phobia that has suddenly been picked up among the general unsuspecting public?","You can't expect people to spend a decade learning stuff, a decade working stuff and then just go do something else or learn something else in a month or two.

People do not like uncertainity and to have their career invalidated so quickly. Whoever is quick enough to jump on the bandwagon to earn quick cash while using AI will not be sad when their cashcow evaporates in a single day. If they learned how to do something for a decade and it suddenly becomes very lucrative and then evaporates in a single day, well they will feel terrible.

How many people actually completely flip around the nature of their career and skillset multiple times in their lifetime? A minority.

A lot of people here seem to have some weird and honestly idiotic comments. 'People hate change and what they dont understand durrrr'. Yeah, people hate losing what they worked for and losing their livelihood. Also people hate living on a street. How irrational is that. Get fu\*ked and be happy. /s

At the end of the day, tommorow you could be losing the job overnight and invalidating everything you know and that was the case before the AI as well. It is like chasing after a constantly accelerating vehicle. 

I am excited about most, but not all things that AI will and might bring, but it is clearly not teaching a damn thing about common sense, because OP is completely void of it lol."
StableDiffusion,"Seriously, what's with the rampant AI-phobia that has suddenly been picked up among the general unsuspecting public?","The standing belief until about 2 years ago or a year ago depending, was that creative work was the safest from automation, now that's been disproven and people/creatives are upset. Because the ideal of automation should be to remove the tedious and unpleasant parts of life while keeping the parts you want, this goes in the face of that a bit. 

Add in a bit of a vocal twitter mob and people believing bullshit perpetuated by said mod and you've got a lot of people hating on something they know very little about."
StableDiffusion,"Seriously, what's with the rampant AI-phobia that has suddenly been picked up among the general unsuspecting public?","> Shouldn't we be making more of an effort to fight against this happening? 

Why? Do you run an AI business? You can waste your time trying to argue with people you're talking past, but I can't imagine why anyone else would."
StableDiffusion,"Seriously, what's with the rampant AI-phobia that has suddenly been picked up among the general unsuspecting public?","Two factors.

One is fear mongering in the MSM, a lot of their coverage of AI is always focussed on the dangers and they're always hyping it up to make people think we're about to be taken over by Skynet.

The second is that a lot of Youtubers just look for whatever is trending to make videos on and then because they don't actually know what they are talking about they often just repeat nonsense they've heard. Most of them don't care as long as it generates views though."
StableDiffusion,"Seriously, what's with the rampant AI-phobia that has suddenly been picked up among the general unsuspecting public?","I'm guessing some outlets (maybe a late show or a YouTuber) took a stance against AI and that's what people now think. 
It's indeed bad to abuse copyrighted material and take jobs away from artists.
But that's not what you and I are doing while playing with SD.

Meanwhile AI is going to be all over AAA games and film production in the next few years, while us peasants are fighting eachother."
StableDiffusion,"Seriously, what's with the rampant AI-phobia that has suddenly been picked up among the general unsuspecting public?",Because ai is going to fuck a lot of things up before it’s used responsibly. And. Capitalism will always ruin everything in a long enough timeline.
StableDiffusion,"Seriously, what's with the rampant AI-phobia that has suddenly been picked up among the general unsuspecting public?","You know who didn’t give a shit when traditional artists, animators and stop motion graphics people were all laid off from the film industry in the 90’s when Jurassic Park proved CG could do it better, cheaper and faster??? That’s right no one! They kicked all those people to the curb and they either had to learn the new tools or kick rocks."
StableDiffusion,"Seriously, what's with the rampant AI-phobia that has suddenly been picked up among the general unsuspecting public?","Ai phobia is not a thing and next we're gonna hear industry shills like this start talking about ai racism and stupid shit like that. Ai is an industry not an identity. It is actively disrupting people's work and livelihoods and is also being incorporated into military uses. It will not only certainly harm society if will literally kill people. Not to mention the millions of poorly treated click workers who are tagging data for AI every day and general users whose data is also being taken en masse to make ai work but neither get any benefit or credit as the industry grows ever more powerful.

Despite how fun SD is (and I enjoy it as well) AI as a whole is doing a shit load of damage and people have good reasons to hate it especially knowing the way tech has grown over the past couple generations with almost zero regard for collective prosperity or humane social practices. It would be a good thing for ai to lose power and be forced to grow more slowly and ethically but that's not gonna happen anyway given the power of the interested parties so OPs post is even more absurd in that context."
StableDiffusion,"Seriously, what's with the rampant AI-phobia that has suddenly been picked up among the general unsuspecting public?",It’s classic misdirection by MSM… Publicly push AI hysteria while privately integrating it into every aspect of their businesses.  Surprising that people are actually still falling for this stuff.  But honestly who cares.  Humanity is a flaming dumpster fire anyways. AI will either help us get out of this rat race and bring upon a better life for everyone or end it all.  I’m down for both of these eventualities.  And sooner rather than later. Sorry but it’s true.  We are not well. Lol
StableDiffusion,"Seriously, what's with the rampant AI-phobia that has suddenly been picked up among the general unsuspecting public?","It's pretty simple.

New technologies have been coming out all the time which replace jobs.  Printing press replaces scribes, computers replace rooms full of people using adding machines and slide rules, bulldozer replaces guys with shovels.  Everyone knows this and it's been this way for centuries.

So when self driving vehicles are supposed to be just around the corner, and millions of truck drivers and uber drivers and so on are about to lose their jobs, everyone says, ""Great, transport will be cheaper, and I guess those guys should have gone to college lol"".

But suddenly AI threatens to replace the good jobs, the jobs done by the important people.  Oh no!  It's not supposed to be this way!  I went to college!  I'm creative!  It's all well and good if some factory worker or warehouse worker loses their job, but not me!

So that's why you're seeing an anti AI narrative now."
StableDiffusion,"Seriously, what's with the rampant AI-phobia that has suddenly been picked up among the general unsuspecting public?","Because the default stance is to be anti-AI, AI questioned our perception of what make us human, being surpassed by a machine with no though, emotion and feelings is deeply unsettling"
StableDiffusion,"Seriously, what's with the rampant AI-phobia that has suddenly been picked up among the general unsuspecting public?","There has been a general media smear campaign against AI in general because it threatens the status quo. 

Propaganda is a hell of a drug."
StableDiffusion,"Seriously, what's with the rampant AI-phobia that has suddenly been picked up among the general unsuspecting public?","The writers' careers are threatened by chatgpt so they wrote many many negative pieces on AI, so the public are influenced"
StableDiffusion,"Seriously, what's with the rampant AI-phobia that has suddenly been picked up among the general unsuspecting public?",my theory is that the ai fear porn is clever marketing to fiuel a stock bubble. if it can kill us all then it must be worth investing in. and investor money is the prize
